{"$id":"https://daimon.invalid/schemas/memory-projection/v1/current.schema.json","$schema":"https://json-schema.org/draft/2020-12/schema","additionalProperties":false,"properties":{"being_ref":{"pattern":"^dm:[a-z0-9-]+:v[01]:[A-Za-z0-9_-]{43}$","type":"string"},"checkpoint":{"additionalProperties":false,"properties":{"hash":{"pattern":"^[0-9a-f]{64}$","type":"string"},"sequence":{"maximum":9007199254740991,"minimum":0,"type":"integer"}},"required":["sequence","hash"],"type":"object"},"entries":{"items":{"additionalProperties":false,"properties":{"author_me_id":{"pattern":"^dm:being:v1:[A-Za-z0-9_-]{43}$","type":"string"},"candidate_id":{"pattern":"^dm:[a-z0-9-]+:v[01]:[A-Za-z0-9_-]{43}$","type":"string"},"category":{"enum":["personal-experience","personal-insight","personal-skill"]},"content_ref":{"additionalProperties":false,"properties":{"byte_length":{"maximum":9007199254740991,"minimum":1,"type":"integer"},"classification":{"enum":["public","personal","private","protected"]},"content_id":{"pattern":"^dm:[a-z0-9-]+:v[01]:[A-Za-z0-9_-]{43}$","type":"string"},"media_type":{"enum":["text/plain","text/markdown"]},"schema":{"const":"dm.memory.content-ref/v1"},"sha256":{"pattern":"^[0-9a-f]{64}$","type":"string"}},"required":["schema","content_id","sha256","byte_length","media_type","classification"],"type":"object"},"context":{"maxLength":128,"minLength":1,"type":"string"},"decision_id":{"pattern":"^dm:[a-z0-9-]+:v[01]:[A-Za-z0-9_-]{43}$","type":"string"},"event_hash":{"pattern":"^[0-9a-f]{64}$","type":"string"},"event_id":{"format":"uuid","type":"string"},"evidence_refs":{"items":{"format":"uuid","type":"string"},"maxItems":256,"type":"array","uniqueItems":true},"memory_id":{"format":"uuid","type":"string"},"origin":{"additionalProperties":false,"properties":{"body_ref":{"maxLength":256,"minLength":1,"type":"string"},"embodiment_id":{"maxLength":256,"minLength":1,"type":"string"},"incarnation_id":{"maxLength":256,"minLength":1,"type":"string"},"principal_id":{"maxLength":256,"minLength":1,"type":"string"}},"required":["body_ref","embodiment_id","incarnation_id","principal_id"],"type":"object"},"policy_id":{"pattern":"^dm:[a-z0-9-]+:v[01]:[A-Za-z0-9_-]{43}$","type":"string"},"sequence":{"maximum":9007199254740991,"minimum":1,"type":"integer"}},"required":["event_id","event_hash","memory_id","sequence","category","author_me_id","context","content_ref","evidence_refs","policy_id","candidate_id","decision_id","origin"],"type":"object"},"maxItems":64,"type":"array"},"manifest_hash":{"pattern":"^[0-9a-f]{64}$","type":"string"},"projection_hash":{"pattern":"^[0-9a-f]{64}$","type":"string"},"schema":{"const":"dm.memory.current-projection/v1"},"total_active":{"maximum":9007199254740991,"minimum":0,"type":"integer"},"truncated":{"type":"boolean"}},"required":["schema","being_ref","manifest_hash","checkpoint","entries","total_active","truncated","projection_hash"],"title":"Current provenance-only personal-memory projection","type":"object"}
