{"being_ref":"dm:being:v1:c020x2AEpKTIXF0hnAal0Q64Ia--MtxTfGGk_e4itVQ","checkpoint":{"hash":"44abdff93cadacc2b67051167100d27ff46510dd51a691ddd0820eadcaa28fdf","sequence":1},"entries":[{"author_me_id":"dm:being:v1:c020x2AEpKTIXF0hnAal0Q64Ia--MtxTfGGk_e4itVQ","candidate_id":"dm:memory-candidate:v1:C3H7CDfMX5sQHv6s6UUi5FrWAyB0EW_aZ4Pwy-Wd2wQ","category":"personal-insight","content_ref":{"byte_length":44,"classification":"personal","content_id":"dm:memory-content:v1:0XVh_5mH4pVN7VHUuG8twCp8h4LdVRRZJ2fLHh9Q1Zs","media_type":"text/plain","schema":"dm.memory.content-ref/v1","sha256":"fa106513d646c223d2607713d0fef6a2d3b69cb5b9c18bbc52ae1ce36246aaf8"},"context":"synthetic-vector","decision_id":"dm:memory-decision:v1:cVoP4BJQNc89rR2V5URlE5wZzpeNDRyc7ENLscH6Ggk","event_hash":"87a9f8508b1dc1edb63d4297c86b030a4da77e71aaa5044c2fa9e2aa3568fd65","event_id":"41000000-0000-4000-8000-000000000001","evidence_refs":["41000000-0000-4000-8000-000000000003"],"memory_id":"41000000-0000-4000-8000-000000000002","origin":{"body_ref":"dm:body:v1:B0iU3se3iyz0g6tPShEM8_Z-oX7BkspNY4KGQzFQEn0","embodiment_id":"dm:embodiment:v1:c6daXNxOWxfE9qM-j85N8YbFN35Q6Kl7g6AYGf7bbZE","incarnation_id":"dm:incarnation:v1:VMS4o9jcMXzf6bmAuMHSsZUMK_g_W9N46SK-LLD_7G8","principal_id":"dm:principal:v1:6RXXWLImY8frx9j_cjrQcMlPTFUnDWkE1GPEolpjong"},"policy_id":"dm:memory-policy:v1:YNPK-T2Rln584pYEmcinSDcMPS1UeUetA8kq_1779UM","sequence":1}],"manifest_hash":"723cb44770be5a2f546e6ed9498809f91d343ea6a01d938bb0fe237a6ed31d4f","projection_hash":"8227d1571b2ffbe652d4a821156eaba74af9c8b3deab33a9333aff63e4a42e01","schema":"dm.memory.current-projection/v1","total_active":1,"truncated":false}
